id,name,lat,lng,name_en,name_la,order,order_en,family,family_en,images,danger,stamps,habitat,habitat_en,diet,diet_en,breeding,breeding_en,dimensions,description,description_en,threats,threats_en,extra,extra_en,unit,alerts,who_is_who,did_you_know,did_you_know_en,keywords,occurrence,occurrence_en
164,Želva sloní santacruzská,50.1165086,14.4052247,Western santa cruz giant tortoise,Chelonoidis niger porteri,želvy,Testudines,želvovití,Testudinidae,,CR,,"vlhčí, hustě zarostlé svahy",humid highlands with abundant vegetation,"tráva, byliny, plody, výhonky","grass, herbs, fruits, shoots",3–16 vajec;inkubace 200 dní,3–16 eggs;incubation 200 days,"[{""title"":""hmotnost"",""value"":""100–350 kg"",""title_en"":""weight""},{""title"":""délka karapaxu"",""value"":""70–130 cm"",""title_en"":""carapace length""}]","Je to největší suchozemská želva a (jako
všechny obří želvy) jeden z nejdéle žijících živočichů: dožívá se více než 150 let. Postavení samců v hierarchii určuje to, který z nich dokáže hlavu natáhnout výše.","It is the largest tortoise and, like all the
giant tortoises, one of the longest living
animals: it has been known to live for
more than 150 years. The males’ position in the hierarchy is determined by which one is able to stretch his head higher.","Z původních desetitisíců želv sloních santacruzských dnes v přírodě zbývá jen asi desetina. Až do 30. let 20. století byly
drancovány kvůli ceněnému tuku. Dnes je ohrožují zdivočelá prasata a další savci, které na ostrovy zavlekl člověk a pro něž
jsou želví vejce i mláďata vítanou pochoutkou. Významnou úlohu v ochraně želv má Darwinova stanice na ostrově Santa Cruz, kde probíhá záchranný chov.","There are only about 3,000 Western Santa
Cruz giant tortoises in the wild. Until the
1930’s, they were decimated for their valuable fat. Nowadays, they are threatened by feral pigs and other mammals brought to the islands by humans for which tortoise eggs and young are a welcome delicacy. Charles Darwin Research Station on the island of Santa Cruz plays an important role in the protection of tortoises through its conservation breeding programme.","V expozici žije jediný zástupce želvy sloní santacruzské v ČR,
samec jménem Eberhard. Poznáte ho podle velice masivní,
široké hlavy.","In this exhibit, you can see the only specimen of the Western
Santa Cruz giant tortoise in Czechia – a male by the name
of Eberhard. You will recognize him by his large, broad head.",10,,,,,,"Jižní Amerika, Galapágy","South America, Galapagos Islands"
10,Agama límcová,50.1162208,14.403565,Frilled lizard,Chlamydosaurus kingii,šupinatí,Squamata,agamovití,Agamidae,"[null,null,""10/ilustration.webp""]",LC,"[{""type"":""Typ"",""description"":""Popis""}]","suché lesy, křovinaté savany","dry forests, savanna woodlands","bezobratlí, občas drobní savci","invertebrates, sometimes small mammals",12–18 vajec;inkubace 54–92 dní,12–18 eggs;incubation 54–92 days,"[{""title"":""hmotnost"",""value"":""400-870 g"",""title_en"":""weight""},{""title"":""délka těla"",""value"":""90-95 cm"",""title_en"":""body length""},{""title"":""délka ocasu"",""value"":""2/3 celkové délky"",""title_en"":""tail length""}]","V klidu se tiskne k větvím či kmenům, s nimiž splývá díky krycímu zbarvení. V ohrožení však prudce zahrozí rozevřením širokého koženého límce a tlamy. Když ani to případného útočníka neodradí, dá se na rychlý útěk po zadních nohách.","It holds on calmly to branches or trunks, with which it blends visually thanks to its covering colour. However, when threatened, it opens its wide leather collar and mouth. If even this does not deter a would-be attacker, it makes a quick escape on its hind legs.",,,,,,,"[{""name"":""a"",""birthdate"":""b"",""parents"":""c"",""marks"":""d"",""marksEN"":""e"",""image"":""10/whois0.webp""},{""name"":""d"",""birthdate"":"""",""parents"":"""",""marks"":"""",""marksEN"":"""",""image"":""10/whois0.webp""}]","Agamy límcové používají límec nejen při zastrašování predátorů, ale i při vzájemném kontaktu či námluvách. Límec je vyztužen dvěma kostěnými paprsky, které jsou součástí jazylkového aparátu, a rozevře se jako deštník díky stahu krčních svalů. Může mít v průměru až 30 cm.","Not only do frilled lizards use their frills to intimidate predators, they also use them for mutual contact or courtship. The frill is reinforced with two bony rods, which are part of the hyoid apparatus, and opens like an umbrella once the neck muscles contract. It can be up to 30 cm in diameter.",,,
139,Želva annamská,50.1162208,14.403565,Vietnamese pond turtle,Mauremys annamensis,želvy,Testudines,batagurovití,Geoemydidae,,CR,,pomalu tekoucí nebo stojaté sladké vody,slow-moving or still bodies of freshwater,malí vodní živočichové a vodní rostliny,"small aquatic animals, aquatic plants",3–6 vajec;inkubace 4 měsíce,3–6 eggs;incubation 4 months,"[{""title"":""délka karapaxu"",""value"":""až / up to 29 cm"",""title_en"":""carapace length""}]","Více než 60 let byla považována za vyhubenou, poté však byla znovu objevena a je možné, že nepočetná populace v přírodě ještě přežívá. Vede skrytý, soumračný způsob života, dny tráví v úkrytu pod kořeny nebo mezi vegetací.","For over 60 years, the Vietnamese pond turtle was considered to be extinct, but it was since re-discovered and it is possible that a small population in the wild still survives. It lives a hidden, twilight existence, spending the days hiding under roots or among vegetation.","Želva annamaská je považována za jednu
z 25 nejohroženějších želv světa. Doplácí
na to, že žije v hustě zalidněné části Asie,
kde si lidé její původní prostředí nárokují
pro sebe, ničí ho, mění v rýžová pole a staví na něm města. Příslovečným hřebíčkem do rakve je pak lov pro maso, které má údajně léčivé účinky.","The Vietnamese pond turtle is considered to be one of the 25 most endangered turtles in the world. It lives in a densely populated part of Asia, where humans have laid claim to its original habitat, destroying it by changing it into rice fields and towns. The proverbial nail in the coffin is the hunt for its meat which is claimed to have healing effects.","Všichni živočichové v tomto teráriu jsou obyvateli vietnamských lesů. Protože však každý obsazuje trochu jiné prostředí, od tůní přes opadanku až po větve keřů, vzájemně si nekonkurují. Přežití kriticky ohrožených želv annamských závisí na rozmnožování v lidské péči. To se Zoo Praha opakovaně daří už od roku 2005.",All the animal species in this terrarium come from Vietnamese forests but occupy slightly different habitats – from pools to the fallen leaf layer to shrubs – and so do not compete with one another. The survival of the critically endangered Vietnamese pond turtles depends on their breeding under human care. Prague Zoo has repeatedly succeeded in breeding them since as early as 2005.,8,,,,,,Asie,Asia
58,Orel kejklíř,50.1170536,14.4074578,Bateleur,Terathopius ecaudatus,dravci,Accipitriformes,jestřábovití,Accipitridae,,NT,,"lesy, křovinná savana a buš",open woodland and tree savanna,"drobná zvířata (živá i mrtvá), vejce","small animals (live or dead), eggs",1 vejce;inkubace 52–59 dní,1 egg;incubation 52–59 days,"[{""title"":""hmotnost"",""value"":""1,8–2,9 kg"",""title_en"":""weight""},{""title"":""délka"",""value"":""55-70 cm"",""title_en"":""length""},{""title"":""rozpětí křídel"",""value"":""168-190 cm"",""title_en"":""wingspan""}]","Má nezvykle krátký ocas, který pod složenými křídly často ani není vidět. Při pátrání po potravě létá nízko nad krajinou a pak se v úzké spirále snáší k zemi. Jednotlivé páry si hájí stálé území, ale mladí ptáci bývají potulní a u bohatého zdroje potravy se jich může shromáždit až padesát.","Bateleurs are colorful eagles with an unusual shape, having such a short tail that they appear tailless. When searching for food, they fly low above the landscape and then swoop in a tight spiral. Adults are territorial, but the young are often nomadic and congregate where food is abundant.","Orel kejklíř žije na mnoha místech Afriky, a tak by se mohlo zdát, že jeho ochrana není nutná. Na většině míst však orlů ubývá, obzvláště v jižních částech jejich areálu, např. v Namibii, Nigérii, Zimbabwe či Jihoafrické republice. Důvodem jsou zřejmě hlavně intenzivní změny v prostředí, používání pesticidů, rušení párů při hnízdění, ale i otravy návnadami líčenými chovateli dobytka.","The bateleur lives in many locations in Africa, so it may seem that it is not necessary to protect it. In most places, however, the eagles are declining, especially in the southern parts of their range, such as Namibia, Nigeria, Zimbabwe or South Africa. This is mainly due to intense changes in the environment, the use of pesticides, disturbing the pairs whilst breeding, but also by poisoned bait left by livestock breeders.","Mladí kejklíři se od svých rodičů liší natolik, že téměř ani nepůsobí jako stejný druh. Jsou totiž celí hnědí, s modrozelenýma nohama a obličejem, které v pozdějším věku přecházejí do hnědé a teprve v dospělosti se barví do šarlatové.","Young bateleurs differ from their parents so much so that they do not even look like the same species. They are entirely brown, with blue-green legs and face. As they age, blue-green turns to brown and then scarlet in adulthood.",,,,"Nohami s ostrými zahnutými drápy dravci chytají kořist, hákovitým zobákem ji pak usmrcují a porcují. 
■ Rybožravé druhy dravců loví většinou z nízkého letu nad hladinou. 
■ Mistrem rychlosti je sokol stěhovavý. Při střemhlavém útoku na letícího ptáka do- sáhne okamžité rychlosti přes 300 km/h. 
■ Druhy lovící pozemní kořist ji obvykle vyhlížejí z výšky, pak se snesou dolů a zezadu na ni nalétávají.","Raptor’s legs with sharp curved claws are important for gripping the prey, while the hooked beak serves for killing and ripping it apart. 
■ Species hunting terrestrial prey usually espy it from a height, then fly down and approach it from behind. 
■ Piscivorous species mostly hunt by flying low over the water. 
■ The peregrine falcon hunts birds in flight and during its headlong diving attack it reaches speeds of over 300 km/h.",,Afrika,Africa
109,Velbloud dvouhrbý dom.,50.1182517,14.4034328,Bactrian camel,Camelus bactrianus,sudokopytníci,Cetartiodactyla,velbloudovití,Camelidae,,VU,,kamenité pouště a polopouště,rocky deserts and semi-deserts,"tráva, byliny, listy, výhonky","grass, herbs, leaves, shoots","březost 13–13,5 měsíce;1 mládě",gestation 13–13.5 months;1 young,"[{""title"":""hmotnost"",""value"":""450–690 kg"",""title_en"":""weight""},{""title"":""výška v kohoutku"",""value"":""150–230 cm"",""title_en"":""shoulder height""}]","Stejně jako divocí velbloudi dvouhrbí,
kteří představují zcela samostatný druh,
je výborně přizpůsobený k životu ve studených pouštích. Díky zásobnímu tuku v hrbech vydrží dlouho bez vody i potravy. Na zimu mu narůstá dlouhá huňatá srst, která na léto opět vylíná.","Similarly to the wild camel, which represents a separate species, this domesticated camelid is very well adapted to
the life in the cold deserts. Thanks to the supplies of fat in the humps it can live for long periods without food or water. For the winter it grows long thick fur that it sheds again for the summer.","Divocí velbloudi nejsou v přírodě vůbec hojní – naopak. Velbloudi jednohrbí dnes existují již jen v domestikované formě, a to i ti, kteří žijí volně, a totéž platí ve velké míře
i pro velbloudy dvouhrbé. Divokých velbloudů dvouhrbých, kteří kdysi obývali rozlehlá území Střední Asie, dnes přežívá jen zhruba tisícovka v poušti Gobi a jsou považováni za kriticky ohrožený druh.","Camels that would be truly wild, not only feral (e.g. domestic turned wild), are very rare in the nature. All of the dromedary camels living today, including those roaming freely, are domesticated, and the same goes for Bactrian camels. The last surviving wild camels are considered a critically endangered species, can be found in the Gobi Desert in China and Mongolia and count only about a thousand individuals.","Zoo Praha se podílí na ochraně divokých velbloudů dvouhr-
bých v přísně chráněné oblasti Velká Gobi A v Mongolsku –
jediné části Mongolska, kde tento druh dosud přežívá.","Prague Zoo is involved in protecting wild camels in the Great
Gobi A Strictly Protected Area in Mongolia – the only part of
Mongolia where this species survives.",24,,,"Velbloudi mají na prstech pružné nášlapné mozoly, které je chrání před ostřejšími kameny a pomáhají předcházet boření do sypkého podkladu. Nozdry mohou uzavřít před
zvířeným prachem a oči mají chráněné mohutnými nadočnicemi a hustými řasami.","Camels have elasticated, hardened calluses
on their toes to protect them from the sharper stones and help prevent sinking into the loose substrate. The nostrils can be closed to prevent dust entering and the eyes are
protected by dense lashes.",,Střední Asie,Central Asia
56,Orel bělohlavý,50.1153731,14.4091208,Bald eagle,Haliaeetus leucocephalus,dravci,Accipitriformes,jestřábovití,Accipitridae,,LC,,okolí vod,"coasts, estuaries","ryby a jiní menší živočichové, mršiny","fish and other small prey, carrion",2–4 vejce;inkubace 35 dní,2–4 eggs;incubation 35 days,"[{""title"":""hmotnost"",""value"":""3,2–6,2 kg"",""title_en"":""weight""},{""title"":""délka"",""value"":""70-96 cm"",""title_en"":""length""},{""title"":""rozpětí křídel"",""value"":""180–237 cm"",""title_en"":""wingspan""}]","Je to druhý největší dravec Severní Ameriky. Vytváří páry na celý život, které používají řadu let stejné hnízdo. Protože ho neustále přistavují, bývají stará hnízda značně velká – největší známé mělo 4 metry na výšku! V zimě se někdy sdružuje do hejn až o tisíci jedincích.","It is the national emblem of the USA. The birds pair for life and use the same nest year after year. This can therefore become very large – the biggest known nest was 4 metres (13 feet) tall! In winter, these eagles sometimes gather in groups of up to a thousand birds.","Ač je orel bělohlavý národním symbolem USA, do 20. století zde byl téměř vyhuben. Na Aljašce mu rybáři vyhlásili válku a za každého zabitého orla tu byla vyplácena vysoká odměna. Druhou pohromou pak bylo užívání pesticidů, zejména DDT, vůči kterému jsou orli velmi citliví. Od 70. let je DDT naštěstí zakázáno, díky důsledné ochraně počet orlů působivě vzrostl a dnes jsou mimo nebezpečí.","Although the bald eagle is the national symbol of the US, it was almost extinct in the 20th century. Alaskan fishermen declared war on the bird and a high reward was paid for each eagle killed. The second scourge was the use of pesticides, especially DDT, to which the eagles are very sensitive. Thankfully DDT has been banned since the 1970’s, and, thanks to consistent protection, the number of eagles has grown impressively and the species is now out of danger.","Bílá barva hlavy a ocasu a žlutý zobák jsou typickým znakem dospělých jedinců. Mladí ptáci mají zobák černý a peří po celém těle tmavě hnědé, později s bílým prokvétáním. Vzhled dospělých získávají postupně a trvá jim to až pět let.","The white head and tail with a yellow beak are typical for adult bald eagles. Young birds have a black beak and dark brown feathers all over their body, later streaked with white. They gradually take on the adult form after a period of up to five years.",,,,"Mnoho druhů dravců předvádí během toku akrobatické zásnubní lety, jejichž smyslem je upevnění vztahu mezi partnery. Během této působivé podívané se oba partneři ve vzduchu otáčejí k sobě břichy a samec, který bývá nahoře, prudce padá na samici, zaklesnou se navzájem pařáty a rotují ve vzduchu.","Many raptor species engage in acrobatic courtship displays; their purpose is to strengthen the relationship between part- ners. During this impressive spectacle both partners turn in the air with their bellies to one another, and the male, who is generally on top, falls swiftly on the female, they grab each other’s claws and rotate in the air.",,Severní Amerika,North America
110,Veverka kapská,50.1186472,14.4094878,Cape ground squirrel,Xerus inauris,hlodavci,Rodentia,veverkovití,Sciuridae,,LC,,"suché savany s roztroušenými keři, polopouště","open arid grassland and shrubland, semi-desert","semena, cibulky, zelené části rostlin, příležitostně i hmyz","seeds, bulbs, green parts of plants, occasionally also insects",březost 42–49 dní;1–3 mláďata,gestation 42–49 days;1–3 young,"[{""title"":""hmotnost"",""value"":""420–650 g"",""title_en"":""weight""},{""title"":""délka těla"",""value"":""24–28 cm"",""title_en"":""body length""},{""title"":""délka ocasu"",""value"":""20–21 cm"",""title_en"":""tail length""}]","Žije v koloniích, které budují podzemní
nory, někdy i ve velmi tvrdém podkladu.
Mnoho času však tráví na povrchu, přičemž svůj ocas používá jako slunečník. Samčí a samičí skupiny využívají každá
svůj vlastní systém nor.","The Cape ground squirrels live in colonies in underground burrows that they dig, often in very hard soils. However,
they spend a lot of time on the surface,
using their tail as a parasol. Male groups
live separately from females.",,,"Veverky kapské jen málokdy pijí. Stačí jim vláha obsažená
v rostlinách, které žerou. S vodou totiž dovedou účinně hospodařit: mají hustou krevní plazmu, velmi koncentrovanou
moč, suchý trus a téměř nevytvářejí sliny (s výjimkou velmi
horkých dní).","Cape ground squirrels rarely drink. The moisture contained
in the plants they eat is sufficient. They are good at conserving water: they have thick blood plasma, very concentrated urine, dry faeces and salivate only in very hot temperatures.",2,,,"Když se blízko kolonie veverek kapských
ocitne jedovatý had, zvířata se kolem něj
seběhnou a začnou ho zastrašovat. Nastavují se mu svým naježeným, na pohled obrovským ocasem, a mávají jím proti němu.

Pro hada sice nepředstavují žádné nebez-
pečí, ale ten se i tak většinou raději stáhne,

protože lov nepřipadá za podobných pod-
mínek v úvahu.","When a venomous snake comes close to a
Cape ground squirrel colony, the animals
will run around it and start intimidating it.
They display their bushy tails, which look
huge, and mob it. Although there is no danger to the snake, it usually retreats as a kill is unlikely in such conditions.",,Jižní Afrika,South Africa
150,Majna chocholatá,50.11654,14.4062211,Crested myna,Acridotheres cristatellus,pěvci,Passeriformes,špačkovití,Sturnidae,,LC,,"otevřená krajina, parky, zahrady","open country, parks, gardens","hmyz a další bezobratlí, plody insects and other","invertebrates, fruits",4–7 vajec;inkubace 14 dní,4–7 eggs;incubation 14 days,"[{""title"":""hmotnost"",""value"":""108–140 g"",""title_en"":""weight""},{""title"":""délka"",""value"":""25 cm"",""title_en"":""length""}]","Chováním se podobá špačkům, se kterými je příbuzná. Podobně jako oni umí zručně napodobovat zvuky z okolí, včetně lidských hlasů. V pražské zoo žilo několik majn už v 50. letech, kdy sem byly věnovány ze zoo v Pekingu.","The crested myna is a gregarious bird from the family of starlings, which it resembles by both its movements and behaviour. Like other starlings, it is adept at imitating the sounds that surround it, including human voices. In its homeland, the myna is an important eradicator of grasshoppers and locusts.",,,,,12,,,,,,Čína,China
111,Orel východní,50.1153731,14.4091208,Steller’s sea-eagle,Haliaeetus pelagicus,dravci,Accipitriformes,jestřábovití,Accipitridae,,VU,,lesnatá pobřeží a říční údolí,forested coasts and valleys along rivers,"ryby (hlavně lososi), mršiny","fish (especially salmon), carcasses",1–3 vejce;inkubace 38–45 dní,1–3 eggs;incubation 38–45 days,"[{""title"":""hmotnost"",""value"":""5–9 kg"",""title_en"":""weight""},{""title"":""délka"",""value"":""85–105 cm"",""title_en"":""length""},{""title"":""rozpětí křídel"",""value"":""195–245"",""title_en"":""wingspan""}]","Patří k největším orlům světa. Při lovu ryb krouží několik metrů nad hladinou nebo čeká na skalisku a pak se vrhá do vody. Druhou metodou lovu je postávání na mělčině nebo na plovoucích kmenech, odkud pak ryby chytá. Rád loví lososy při jejich tahu proti proudu řek.","It is one of the largest eagles in the world. When hunting for fish, these majestic birds circle several metres above the water level or wait on a rock and then dive into the water. They enjoy catching salmon when the fish migrate upstream.","Přestože je orel východní na celém území svého výskytu zákonem chráněný, jeho stavy neustále klesají. Vinu na tom má především rozvíjející se petrochemický průmysl, výstavby vodních elektráren, znečišťování řek a intenzivní rybolov. Také těžba dřeva v místech stálých hnízdišť orlů vytlačuje tyto dravce do méně vhodných prostředí.","Although Steller’s sea eagle is legally pro- tected throughout its territory, it is in con- stant decline. This is primarily due to the developing petrochemical industry, the con- struction of hydropower plants, river pollution and intensive fishing. In addition, felling in locations where the eagles have their nests pushes these raptors into less suit- able environments.","První mládě vychovali naši orli východní Matyáš a Matylda v roce 2007. Od té doby jich bylo již více než 20, včetně trojčat v roce 2017. Jednalo se tehdy o vůbec první známý případ odchovu trojčat u orlů východních v lidské péči.
Mladí orli východní nemají na rozdíl od dospělých velké bílé plochy na těle a jejich zobák má nevýraznou barvu, místo aby byl zářivě žlutý.","Our Steller’s sea eagles, Matyáš and Matylda, raised their first chick in 2007. Since then, there have been more than 20, including triplets in 2017. It was the first ever known case of Steller’s sea eagle triplets being reared in captivity.
Unlike the adults, young Steller’s sea eagles do not have large white areas on their bodies and their bill has an indistinctive colour instead of being bright yellow.",,,,"Dravci často snášejí o jedno vejce víc, než kolik pak vychovají mláďat. Samice totiž snáší vejce v rozmezí dvou nebo tří dnů, ale zasedá již na první či druhé snesené vejce. Mláďata se tak líhnou postupně a je mezi nimi velký rozdíl ve velikosti i vývoji. Nejmenší mládě přežije jen v hojných letech, v ostatních případech se stane potravou pro starší sourozence.","Birds of prey often lay one egg more than the young they raise. The female lays eggs over two or three days, but sits on the first or second egg. The youngsters therefore hatch progressively (for eagles this can be in the range of up to 6 days) and there is a big difference between them in size and development. The smallest youngster only survives in bountiful years; otherwise it usually becomes food for the older sibling.",,Asie,Asia
185,Pižmovka hřebenatá,50.1168669,14.4027417,African comb duck,Sarkidiornis melanotos,vrubozobí,Anseriformes,kachnovití,Anatidae,,LC,,"podmáčené lesy, jezera, řeky","swamp forests, lakes, rivers","semena, vodní rostliny i drobní živočichové","seeds, aquatic plants, small animals",7–15 vajec;inkubace 28–30 dní,7–15 eggs incubation 28–30 days,"[{""title"":""hmotnost"",""value"":""1,2–2,6 kg"",""title_en"":""weight""},{""title"":""délka"",""value"":""56–76 cm"",""title_en"":""length""}]","Obvykle hnízdí ve stromových dutinách, méně často i ve vysoké trávě. Samec mívá více partnerek a všichni společně brání mláďata. Nad kořenem zobáku má samec masitý diskovitý hrbol, který se v době toku zvětšuje.","They usually nest in the hollows of trees, occasionally also in tall grass. Males may have several mates and they help them in defending the young. The male can be distinguished by a distinctive knob on the bill that grows larger during the mating season.",,,,,25,,,,,,"Afrika, Asie","Africa, Asia"
