id,name,lat,lng,name_en,name_la,order,order_en,family,family_en,images,danger,stamps,habitat,habitat_en,diet,diet_en,breeding,breeding_en,dimensions,description,description_en,threats,threats_en,extra,extra_en,unit,alerts,who_is_who,did_you_know,did_you_know_en,keywords,occurrence,occurrence_en
34,"Seriema rudozobá
",0,0,Red-legged Seriema,Cariama cristata,seriemy,Cariamiformes,seriemovití,Cariamidae,,LC,,pampa,pampas,"malí obratlovci, větší hmyz","small vertebrates, larger insects",2–3 vejce;inkubace 27–29 dní,2–3 eggs;incubation 27–29 days,"[{""title"":""hmotnost"",""value"":""1,7-2,6 kg"",""title_en"":""weight""},{""title"":""délka těla"",""value"":""75-9O cm"",""title_en"":""body length""},{""title"":""výška"",""value"":""85 cm"",""title_en"":""height""}]","Seriemy patří do příbuzenstva vymřelých obřích hrůzoptáků, pozemních dravců známých z filmu Cesta do pravěku. Loví  drobná zvířata včetně hadů, které chytí do zobáku a zabijí několika prudkými údery o zem. Přestože velmi dobře létají, dávají přednost rychlému běhu.","Seriemas are relatives of the giant “terror birds”, extinct, flightless, carnivorous birds from South America. They hunt  small animals, including snakes, catch- ing them in their beak and killing them with several swift blows on the ground. They can fly very well but prefer running.",,,"Seriemy se dají dobře ochočit, Indiáni je proto někdy chovají, aby je zbavovaly myší a hadů. Protože jsou navíc velmi ostražité a své teritorium bojovně brání, uplatní se mezi menšími hospodářskými zvířaty i jako živý alarm a „ochranka“.","Seriemas can be easily tamed, and Native Americans often keep them for getting rid of mice and snakes. Because they are very vigilant and pugnaciously defend their territory, they are used as alarms and “security guards” among smaller domestic animals.",,"{""text"":""Pozor, máme ostré zobáky!"",""text_en"":""Caution, we have sharp beaks!"",""text_ru"":""Осторожно, у нас острые клювы!""}",,"Seriemy žijí v trvalých párech a své území  si označují daleko slyšitelným hlasem. Volat začíná většinou samec. Zakloní hlavu, krkem „pumpuje“ nahoru a dolů a vydává ostrý, štěkavý hlas. Samice se přidává s malým zpožděním. Mláďata jsou schopna volat podobně jako jejich rodiče již ve dvou týdnech a často jim pomáhají bránit rodinné teritorium.","Seriemas live in permanent couples and mark out their territory with a very audible voice. The male usually starts calling. He tilts his head back, pumps his neck up and down and emits a piercing, barking noise. The female joins him slightly later. At just two weeks the young can call similarly to their parents and often help them defend the family territory.",,jižní Amerika,South America
129,Osinák africký,50.1206483,14.404035,African brush-tailed porcupine,Atherurus africanus,hlodavci,Rodentia,dikobrazovití,Hystricidae,,LC,,tropické vlhké lesy,tropical humid forest,"listy, plody","leaves, fruits",březost 100–110 dní;1–2 mlaďata,gestation 100–110 days;1–2 young,"[{""title"":""hmotnost"",""value"":""1,5–4 kg"",""title_en"":""weight""},{""title"":""délka těla"",""value"":""36–60 cm"",""title_en"":""body length""},{""title"":""délka ocasu"",""value"":""15–23 cm"",""title_en"":""tail lenght""}]","Zdržuje se na zemi, umí ale i šplhat. Aktivní je v noci, den tráví ve skalní rozsedlině nebo pod kořeny stromů. Nepřátele zastrašuje dupáním a šustivým zvukem štětky tuhých chlupů na konci ocasu, kterým třese.","It is nocturnal and spends the day in rock crevices or under tree roots. It keeps to the ground but can climb to some extend too. It intimidates enemies by stomping its feet and rattling its stiff tail quills, which are brush like.",,,Mnohým (zejména) býložravým živočichům se v trávicím traktu z nestrávených zbytků potravy vytváří bezoáry. Tyto útvary připomínající kámen jsou ceněným artiklem tradiční medicíny. Ve velkém jsou kvůli nim loveni dikobrazi v Asii. Touha po bezoáru může ohrozit i osináky africké.,"Many animals, especially herbivores, develop bezoars in
their digestive tract from the remains of undigested food.
These stone-like formations are highly prized in traditional
medicine. This has led to porcupines being widely hunted
in Asia. The desire for bezoars can also threaten the African
brush-tailed porcupine.",,,,Osináci patří v západní Africe mezi nejoblíbenější a nejvíce konzumované lesní živočichy. Oficiálně nejsou považováni za ohrožené. Intenzivní lov a růst lidské populace však může ohrozit i tyto hlodavce.,"In West Africa the brush-tailed porcupine is one of the most popular and widely consumed forest animals. Officially they are not considered endangered. However, intensive hunting and the growth in human populations may well threaten these rodents.",,Afrika,Africa
156,Želva dlaždicovitá,50.1164331,14.4045497,Impressed tortoise,Manouria impressa,želvy,Testudines,želvovití,Testudinidae,,VU,,stálezelené horské lesy,evergreen mountain forests,"houby, bambusové výhonky","mushrooms, bamboo shoots",19–21 vajec;inkubace 72–79 dní,19–21 eggs;incubation 72–79 days,"[{""title"":""hmotnost"",""value"":""až 3 kg / up to 3 kg"",""title_en"":""weight""},{""title"":""délka karapaxu"",""value"":""až 31 cm / up to 31 cm"",""title_en"":""carapax length""}]","Má nezvyklý jídelníček, který je z větší části tvořen houbami. Mezi želvami vyniká také rozvinutou rodičovskou péčí: samice buduje pro vejce vysokou hnízdní kupku a po nakladení snůšku několik týdnů bedlivě střeží.","It has an unusual diet, of which mushrooms form a large part. It stands out among turtles and tortoises in its parental care: the female builds a high nest for the eggs and after laying the clutch she carefully keeps watch for several weeks.","Želvy dlaždicovité jsou velmi citlivé na zásahy do svého prostředí. Jejich areál se může zdát rozlehlý, ve skutečnosti je však roztříštěný na maličké ostrůvky vklíněné mezi nehostinné plochy polí a osad. Navíc jsou bohužel zhusta loveny pro maso a spodní díly krunýře.","Impressed tortoises are very sensitive to
disturbances in their environment. Their
area may seem vast, but in fact it is fragmented into tiny islands wedged between the inhospitable fields and settlements. Moreover, they are sadly hunted for their meat and the bottom part of the shell, called the plastron.","Želvy dlaždicovité jsou tak choulostivé, že byl jejich chov
donedávna pokládán za téměř nemožný. Zoo Praha je
jediná zoo v Evropě, kde je můžete spatřit.","Impressed tortoises are so sensitive that, until recently,
keeping them in captivity was considered almost impossible. Prague Zoo is the only zoo in Europe to have kept them on display.",14,,,,,,Jihovýchodní Asie,Southeast Asia
68,Holub podkovní,0,0,Spotted imperial pigeon,Ducula carola,měkkozobí,Columbiformes,holubovití,Columbidae,,VU,,subtropické a tropické vlhké lesy,subtropical and tropical moist forest,"dužnaté plody, bobule","pulpy fruits, berries",1 vejce;inkubace 24–25 dní,1 egg;incubation 24–25 days,"[{""title"":""hmotnost"",""value"":""290 g"",""title_en"":""weight""},{""title"":""délka"",""value"":""33 cm"",""title_en"":""length""}]","Žije výhradně na Filipínách, kde vytváří několik poddruhů, lišících se zbarvením a tvarem podkovy na hrudi. Je pospolitý a na stromech se zrajícím ovocem se někdy shromažďuje ve velkých počtech. Za potravou běžně putuje i na velké vzdálenosti.","It lives exclusively in the Philippines, where it has formed several subspecies, differing in colouration and the horseshoe shape on the chest. It is gregarious, and sometimes gathers in large numbers in trees with ripening fruit. It often travels long distances for food.","Počty holubů podkovních v přírodě setrvale klesají, místy již dokonce vyhynuli. Jsou totiž vázáni na souvislé lesní porosty, těch je však na Filipínách čím dál méně. Holubi přitom potřebují velkou plochu neporušeného lesa, aby našli dostatek potravy. Pospolitá povaha je navíc činí snadnějším terčem pro lovce.","Spotted imperial pigeon numbers in the wild are steadily declining, in places it is even extinct. It is dependent on contiguous forest growth, needing a large area of intact forest to find enough food, but there is less and less in the Philippines. In addition, the gregarious nature of these pigeons makes them an easy target for hunters.",Holub podkovní je v zoologických zahradách skutečnou raritou a i u soukromých chovatelů je chován jen velmi zřídka. Mláďata tohoto druhu odchovala Zoo Praha v roce 2010 jako první zoo v Evropě.,The spotted imperial pigeon is a rare occurrence in zoos and it is rarely kept even by private breeders. Prague Zoo reared young spotted imperial pigeons in 2010 as the first zoo in Europe.,,,,,,,Filipíny,Philippines
33,Voduška červená,50.1196681,14.4074642,Southern lechwe,Kobus leche,sudokopytníci,Cetartiodactyla,turovití,Bovidae,,NT,,"vlhká savana, mokřady","floodplains, swamps",části rostlin,floodplain and aquatic grasses,březost 225 dní;1 mládě,gestation 225 days;1 young,"[{""title"":""hmotnost"",""value"":""60–130 kg"",""title_en"":""weight""},{""title"":""výška v kohoutku"",""value"":""80–100 cm"",""title_en"":""shoulder height""},{""title"":""délka ocasu"",""value"":""30–45 cm"",""title_en"":""tail length""}]","Voduška červená žije jako všechny vodušky ve stádech. Samci mají dlouhé lyrovité rohy, samice jsou bezrohé. Rohy slouží hlavně při soubojích s příslušníky vlastního druhu, před predátory se vodušky brání ostrými kopyty.","Like all lechwe antelopes, the
Southern lechwe live in herds.
Males have long lyre-like horns,
which they use in mutual fights,
while females are hornless. The
lechwe uses its sharp hooves
as defence against predators.","V naší zoo chováme vodušky červené z mokřadů středního toku zambijské řeky Kafue (K. l. kafuen-
sis). Na řece však byly v 70. letech

postaveny přehrady a krajinu za-
růstají invazivní keře, je zde pasen

dobytek a mezi voduškami se šíří
nemoci. Jsou proto považovány za
ohrožené.","Here at Prague we have lechwes
from the wetlands of Zambia’s
Kafue River (K. l. kafuensis). However, dams were built on this river in the 1970’s and the landscape is covered by invasive shrubs, intensivelly grazed by livestock, and diseases are spreading among the lechwe. Thus lechwes are declin-
ing around the Kafue River and are considered to be endangered.","Vodušky červené žijí v pražské zoo od roku 2002. O čtyři
roky později přišel chovný samec z Košic, a brzy následovala první mláďata. Od té doby jich u nás vyrostla již dvacítka.","Southern lechwe have been living at Prague Zoo since 2002.
Four years later a breeding male came from Košice Zoo
in Slovakia and the first young soon followed. Since then,
around twenty have been brought up.",1,,,"Většinu roku žijí vodušky ve velkých stádech, často pohromadě s jinými druhy kopytníků. Během námluv si však dospělí samci vytyčí jednotlivá malá teritoria, nahloučená těsně u sebe. Soky zastrašují hrozbou a imponováním, a když to nepomůže, začnou se přetlačovat.","Lechwes live in large herds for most of the year, often mixed with other species of ungulates. During the mating season, however, adult males establish small, tightly packed territories, intimidating their rivals with threats and displays. If that does not work they will lock horns.",,Afrika,Africa
70,Varan plodožravý,0,0,Gray’s monitor,Varanus olivaceus,šupinatí,Squamata,varanovití,Varanidae,,VU,,deštné lesy,rainforest,"u mláďat hlavně plži a krabi, u dospělých plody","crabs and snails in juveniles, fruits in adults",až 11 vajec;inkubace 7 měsíců,up to 11 eggs;incubation 7 months,"[{""title"":""hmotnost"",""value"":""samci průměrně 6,7 kg, samice 2,6 kg"",""title_en"":""weight""},{""title"":""délka"",""value"":""výjimečně až 2 m"",""title_en"":""length""}]","Do roku 1975 byl znám jen ze dvou muzejních kusů a mělo se za to, že vyhynul. Žije skrytě a díky ochrannému zbarvení
a zvyku odpočívat v dutinách stromů či
puklinách skal uniká pozornosti. Mezi jinak dravými varany je neobvyklý jídelníčkem, tvořeným zralými plody.","Until 1975, it was known only through
two museum pieces and was assumed
to be extinct. Due to its secretive habits
and protective colouring, it has escaped
attention. Among the otherwise predatory monitor species it has an unusual diet made up of ripe fruit that is collected on the ground.","Dospělí varani plodožraví mají jen málo přirozených nepřátel. Jejich jedinými významnými predátory jsou krajty a lidé, kteří varany loví pro maso a především pro žádaný tuk. Mláďata jsou pak lidmi chytána a prodávána coby terarijní zvířata. Nejvíce však varany ohrožuje ztráta jejich přirozeného
prostředí a jeho rozdrobování.","Adult Gray’s monitors have few natural enemies. Their only significant predators are pythons and people who hunt them for the meat, particularly the highly-desired fat.
The juveniles are captured and sold on the
pet markets. However, the Gray’s monitors
are most under threat from the loss of their
habitat and its fragmentation.","Podobně jako jiní varani včetně varanů komodských, i samci varanů plodožravých svádějí v době rozmnožování souboje, během kterých se vztyčí na zadní a vzájemně se přetlačují.","Similar to other monitor lizards, including the Komodo
dragon, male Gray’s monitors also fight for females during
the mating season; during this they stand on their hind
legs and push each other.",,,,,,,"Asie, Filipíny","Asia, Philippines"
72,Holub růžový,0,0,Pink pigeon,Nesoenas mayeri,měkkozobí,Columbiformes,holubovití,Columbidae,,VU,,původní tropické lesy,native tropical forest,"květy, listy, plody, semena, bezobratlí","flowers, leaves, fruits, seeds, invertebrates",2 vejce;inkubace 13–15 dní,2 eggs;incubation 13–15 days,"[{""title"":""hmotnost"",""value"":""291-315 g"",""title_en"":""weight""},{""title"":""délka"",""value"":""40 cm"",""title_en"":""weight""}]","Je posledním z původně možná až 10 druhů holubů Maskarénských ostrovů, i on měl ale namále. V důsledku rozsáhlého kácení lesů a zavlečení predátorů na Mauricius ve 2. polovině 20. století málem vyhynul. O jeho záchranu se zasadil spisovatel a zoolog Gerald Durrell.",It is the last indigenous pigeon species from the Mascarene Islands. It had a narrow escape though – massive forest destruction and predation by introduced animals have almost wiped it out in the 2nd half of the 20th century. The writer and zoologist Gerald Durrell contributed greatly to its preservation.,"Holub růžový je krásnou ukázkou úspěšné záchrany druhu, který již zdánlivě neměl šanci. V roce 1990 žilo ve volné přírodě pouhých 10 jedinců, obývajících jediný šestihektarový lesík. Díky přísné ochraně, intenzivní péči a vypouštění odchovaných ptáků se však holubí populace obdivuhodně zotavila a od roku 2000 neklesl počet holubů růžových v přírodě pod 300. Proto již nejsou považováni za kriticky ohrožený druh, ale „jen“ za druh zranitelný.","The pink pigeon is a beautiful example of the successful rescue of a species that apparently had no chance. In 1990, there were only 10 individuals living in a single six-hectare forest in the wild. Due to strict protection, intensive care and release of birds bred in captivity, however, the pigeon population has recovered admirably and since 2000 the number of pink pigeons in the wild has not dropped below 300. Therefore, they are no longer considered a critically endangered species, “only” a vulnerable species.","Holubi pijí jinak než většina ostatních ptáků. Zatímco jiní ptáci obvykle každý doušek naberou do zobáku, zvednou hlavu a nechají tekutinu stéct do krku, holubi ponoří zobák do vody a plynule sají.

Holubí rodiče svá mláďata nekrmí tím, čím se živí oni sami. Namísto toho jim ve svém voleti vytvářejí speciální „dětskou výživu“, tzv. holubí mléko – tvarohovitou hmotu bohatou na bílkoviny.","Pigeons have a different way of drinking to most other birds. While other birds usually take each sip into the beak, lift their heads and let the fluid run down the throat, the pigeon submerges its beak into the water and sucks.

Pigeon parents do not feed their young with the same things
they themselves eat. Instead, they secrete a special “baby
nutrition” called crop milk, which is like a protein-rich curd.",,,,,,,Mauricius,Mauricius
144,"Lorikul modrobradý ",0,0,Vernal hanging-parrot,Loriculus vernalisi,papoušci,Psittaciformes,papouškovití,Psittacidae,,LC,,"lesy, bambusové houštiny, kulturní krajina","forest, bamboo thickets, cultivated land","měkké plody, drobná semena","soft pulp of fruits and berries, small seeds",2–4 vejce;inkubace 22 dny,2–4 eggs;incubation 22 days,"[{""title"":""hmotnost"",""value"":""28–36 g"",""title_en"":""weight""},{""title"":""délka"",""value"":""13 cm"",""title_en"":""length""}]","Při spánku nebo odpočinku se často zavěšuje hlavou dolů, proto se mu také říká netopýřík. Na papouška je nezvykle tichý a vytváří jen málo početné skupinky. Hnízdí v přirozených dutinách v tlejících kmenech nebo větvích.",It is a fairly quiet parrot that often hangs head down on a branch when sleeping or relaxing and therefore it is known also as a “bat parrot”. It nests in natural hollows in decaying trunks or branches and forages in small flocks.,,,,,,,,"Na ptačím těle rozlišujeme několik typů per. 
1. Obrysová, rozlišovaná dále na: a. krycí pera – svrchní vrstva těla; b. letky – na křídlech, umožňují let; c. rýdovací pera – namísto ocasu, umožňují v letu manévrovat. 
2. Prachová, tvořící teplou „podsadu“. 
3. Vlasová, upozorňující na rozčepýřené obrysové peří a snad i pomáhající určovat rychlost letu. 
4. Štětinová kolem zobáku, nozder a očí, s hmatovou funkcí.","Birds’ bodies have several types of feathers. 
1. Contour feathers form the basic outer layer. On the wings and tail, they are transformed to create the flight feathers – specialized feathers allowing flight – and the tail feathers that allow the bird to manoeuvre in flight. 
2. Down feathers under the contour feathers are used for insulation. 
3. Filioplumes warn when the contour feathers are ruffled and may even help determine the speed of the flight. 
4. Bristles may grow around the beak, nose and eyes and have a tactile function.",,Asie,Asia
73,Varan smaragdový,50.1162208,14.403565,Green tree monitor,Varanus prasinus,šupinatí,Squamata,varanovití,Varanidae,,LC,,"stromové patro tropických lesů, mangrovy","treetops in tropical forests, mangroves","hmyz, malí plazi, ptáci a savci","insects, small reptiles, birds, mammals",1–5 vajec;inkubace 6 měsíců,1–5 eggs;incubation 6 months,"[{""title"":""hmotnost"",""value"":""105–170 g"",""title_en"":""weight""},{""title"":""celková délka"",""value"":""75–100 cm"",""title_en"":""Total length""},{""title"":""délka ocasu"",""value"":""nejméně 60 % celkové délky"",""title_en"":""tail length""}]","Jasně zelené zbarvení varana smaragdového je přizpůsobením k životu v korunách stromů, kde se i rozmnožuje – samice klade vajíčka do hnízd stromových všekazů. Jeho rozmnožení v lidské péči je spíše vzácností, Zoo Praha se řadí k jeho nejúspěšnějším chovatelům.","The bright green colouring of this monitor lizard indicates clearly its adaptation to life in the treetops. Even reproduction takes place above ground: the female lays the eggs onto nests of tree-dwelling termites. Its breeding under human care is somewhat rare, Prague Zoo is one of the most successful breeders.",,,Zoo Praha rozmnožila varany smaragdové jako první zoologická zahrada v Evropě – v roce 1996. V následujících 20 letech jsme odchovali 6 generací tohoto náročného druhu!,"Prague Zoo was the first European zoo to reproduce the
green tree monitor, notching up this achievement in 1996.
In the 20 years that followed, we raised 6 generations of this
demanding species!",8,,,,,,Austrálie,Australia
88,Husovec straċí,0,0,Magpie goose,Anseranas semipalmata,vrubozobí,Anseriformes,husovcovití,Anseranatidae,,LC,,záplavové nížiny a pole v okolí tropických řek,"swamps, floodplains","tráva, semena","grass, seeds",5–11 vajec;inkubace 23–25 dní,5–11 eggs;incubation 23–25 days,"[{""title"":""hmotnost"",""value"":""1,4-3,2 kg"",""title_en"":""weight""},{""title"":""délka"",""value"":""70-90 cm"",""title_en"":""length""},{""title"":""rozpětí křídel"",""value"":""125-165 cm"",""title_en"":""wingspan""}]","Je velmi pospolitý: hnízdí v koloniích a mimo dobu hnízdění se sdružuje do leckdy tisícihlavých hejn. Pozoruhodný je jeho způsob hnízdění: samec mívá často dvě partnerky, přičemž všichni tři ptáci společně pečují o vejce i mláďata, kterým nosí ve špičce zobáku potravu.","It is a highly gregarious species, nesting in colonies and forming flocks of up to a few thousand birds outside the breeding season. Some males mate with two females and all the three birds then raise the young together, bringing them food in the tips of their bills.",,,,,,,,,,,Severní Austrálie,Northern Australia
158,Želva obrovská,50.1165086,14.4052247,Aldabra giant tortoise,Aldabrachelys gigantea,želvy,Testudines,želvovití,Testudinidae,,VU,,"suché světlé lesy, křoviny","dry clear woods, bushes","tráva, spadané listí","grass, fallen leaves",9–25 vajec;inkubace 8 měsíců,9–25 eggs;incubation 8 months,"[{""title"":""hmotnost"",""value"":""60–250 kg"",""title_en"":""weight""},{""title"":""délka karapaxu"",""value"":""50–130 cm"",""title_en"":""carapace length""}]","Je nesmírně houževnatá a dokáže přežít několikaměsíční hladovění a žíznění; hůře snáší jen nedostatek stínu. V období sucha se spokojí s vodou z ranní rosy, kterou nasává vysunutými nozdrami. Žije ve skupinách.","It is extremely resilient and can survive
several months of starvation and thirst;
the only thing it does not tolerate is
a lack of shadow. During the dry season it can happily live off morning dew, which is sucked in by its protuberant extended nostrils. It lives in groups.","Kdysi žily velké želvy na většině ostrovů
západního Indického oceánu a mořeplavci
i kolonisté je v obrovských počtech chytali
jako vydatný zdroj masa. Do 19. století zmizely odevšad kromě neobydleného atolu Aldabra. Dnes jsou želvy obrovské chráněné, daří se je množit v záchranných chovech
a byly vysazeny na některé další ostrovy
jako náhrada za původní vyhubené druhy.","Once giant turtles lived on most of the islands of the western Indian Ocean, and seafarers and colonists captured them in
huge numbers as an abundant source of meat. By the 19th century they had disappeared, apart from the uninhabited atoll of Aldabra. Nowadays Aldabra giant tortoises are protected, they manage to breed in conservation breeding centres and have been reintroduced to some other islands as a replacement for the original, extinct species.","Vůdcem naší želví skupiny je samec želvy obrovské Toro.
Poznáte ho snadno: s hmotností přes 200 kg je ze všech želv obrovských největší a má vysoko klenutý krunýř s výrazně vystouplými štítky.","The leader of our giant tortoise group is Toro, a male Aldabra giant tortoise. He is easily recognizable: weighing over 200 kg, he is the largest Aldabra giant tortoise in Prague Zoo. Look out for his high-domed shell with very prominent
scutes.",10,,,"Mezi želvami najdeme býložravce, predátory, všežravce i potravní specialisty – třeba želvy živící se převážně houbami. Některé potravu aktivně hledají, další, jako kajmanka, na kořist nehybně číhají. Nemají zuby, ale ostrým rohovinovým okrajem čelistí dokážou zpracovat i tvrdé kosti.
","Tortoises and turtles can be herbivores,
predators, omnivores and food specialists –
such as species that predominantly eat
mushrooms. Some actively seek their food,
others, like the snapping turtle, lie in wait
for their prey. They do not have teeth but
thanks to the horny edge of the jaws, they
can break even hard bones.",,"Afrika, Seychely","Africa, Seychelles"
